{
  "submissionId": "fixture-pdf-overwritten-mr",
  "contractVersion": "ingest-output.v0",
  "segments": [
    { "segId": "s_0001", "source": { "type": "pdf", "documentId": "doc_pdf_1", "page": 1, "bbox": [72, 140, 520, 162] }, "text": "शिलाई केंद्र: ब्लाउज, ड्रेस आणि शाळेचे गणवेश", "lang": "mr", "textEn": "Tailoring centre: blouses, dresses and school uniforms", "translit": null, "struck": false, "supersededBy": null, "confidence": 0.97 },
    { "segId": "s_0002", "source": { "type": "pdf", "documentId": "doc_pdf_1", "page": 1, "bbox": [72, 196, 520, 218] }, "text": "गावातील महिला आणि दोन शाळा", "lang": "mr", "textEn": "Women in the village and two schools", "translit": null, "struck": false, "supersededBy": null, "confidence": 0.96 },
    { "segId": "s_0003", "source": { "type": "pdf", "documentId": "doc_pdf_1", "page": 1, "bbox": [72, 252, 520, 274] }, "text": "येवला, नाशिक 423401", "lang": "mr", "textEn": "Yeola, Nashik 423401", "translit": null, "struck": false, "supersededBy": null, "confidence": 0.98 },
    { "segId": "s_0004", "source": { "type": "pdf", "documentId": "doc_pdf_1", "page": 2, "bbox": [72, 96, 300, 118] }, "text": "₹२०,०००", "lang": "mr", "textEn": "₹20,000", "translit": null, "struck": true, "supersededBy": "s_0005", "confidence": 0.95 },
    { "segId": "s_0005", "source": { "type": "pdf", "documentId": "doc_pdf_1", "page": 2, "bbox": [310, 96, 520, 118] }, "text": "₹१२,००० दरमहा", "lang": "mr", "textEn": "₹12,000 per month", "translit": null, "struck": false, "supersededBy": null, "confidence": 0.95 },
    { "segId": "s_0006", "source": { "type": "pdf", "documentId": "doc_pdf_1", "page": 2, "bbox": [72, 150, 520, 172] }, "text": "[Left Blank]", "lang": "und", "textEn": null, "translit": null, "struck": false, "supersededBy": null, "confidence": 0.99 }
  ],
  "qa": [
    { "qId": "q1", "question": "आपण कोणती उत्पादने किंवा सेवा देणार?", "questionLang": "mr", "answerSegIds": ["s_0001"], "canonicalField": "offering", "mappingConfidence": 0.95, "state": "answered", "overwrites": [] },
    { "qId": "q2", "question": "आपले ग्राहक कोण आहेत?", "questionLang": "mr", "answerSegIds": ["s_0002"], "canonicalField": "customers", "mappingConfidence": 0.94, "state": "answered", "overwrites": [] },
    { "qId": "q3", "question": "व्यवसाय कुठे सुरू करणार?", "questionLang": "mr", "answerSegIds": ["s_0003"], "canonicalField": "location", "mappingConfidence": 0.95, "state": "answered", "overwrites": [] },
    { "qId": "q4", "question": "दर महिन्याला किती कमाई अपेक्षित आहे?", "questionLang": "mr", "answerSegIds": ["s_0005"], "canonicalField": "monthly_revenue", "mappingConfidence": 0.93, "state": "answered", "overwrites": [{ "fromSegId": "s_0004", "toSegId": "s_0005" }] },
    { "qId": "q5", "question": "आपले पुरवठादार कोण असतील?", "questionLang": "mr", "answerSegIds": [], "canonicalField": "suppliers", "mappingConfidence": 0.92, "state": "missing", "blankMarker": "[Left Blank]", "overwrites": [] },
    { "qId": "not_asked_market_research", "question": null, "questionLang": "mr", "answerSegIds": [], "canonicalField": "market_research", "mappingConfidence": null, "state": "not_asked", "overwrites": [] }
  ],
  "fields": {
    "offering": { "value": "Tailoring centre: blouses, dresses and school uniforms", "segIds": ["s_0001"], "confidence": 0.93 },
    "customers": { "value": "Village women and two schools", "segIds": ["s_0002"], "confidence": 0.92 },
    "location": { "value": "Yeola, Nashik district, PIN 423401", "segIds": ["s_0003"], "confidence": 0.95 },
    "monthly_revenue": { "value": "₹12,000 per month (corrected from ₹20,000)", "segIds": ["s_0005"], "confidence": 0.92 }
  },
  "summary": { "value": "Village tailoring centre making blouses, dresses and uniforms for local women and two schools.", "segIds": ["s_0001", "s_0002"], "confidence": 0.9 },
  "problemAddressed": null
}
