{
  "submissionId": "fixture-typed-accurate-en",
  "contractVersion": "ingest-output.v0",
  "segments": [
    { "segId": "s_0001", "source": { "type": "text", "documentId": "doc_typed_1", "charStart": 0, "charEnd": 47 }, "text": "Near the weekly market in Sinnar, Nashik 422103", "lang": "en", "textEn": "Near the weekly market in Sinnar, Nashik 422103", "translit": null, "struck": false, "supersededBy": null, "confidence": null },
    { "segId": "s_0002", "source": { "type": "text", "documentId": "doc_typed_1", "charStart": 0, "charEnd": 79 }, "text": "Mobile phone repair: screens, batteries, charging ports, and second-hand phones", "lang": "en", "textEn": "Mobile phone repair: screens, batteries, charging ports, and second-hand phones", "translit": null, "struck": false, "supersededBy": null, "confidence": null },
    { "segId": "s_0003", "source": { "type": "text", "documentId": "doc_typed_1", "charStart": 0, "charEnd": 81 }, "text": "Farmers and students from 12 nearby villages, mostly aged 18 to 45, men and women", "lang": "en", "textEn": "Farmers and students from 12 nearby villages, mostly aged 18 to 45, men and women", "translit": null, "struck": false, "supersededBy": null, "confidence": null },
    { "segId": "s_0004", "source": { "type": "text", "documentId": "doc_typed_1", "charStart": 0, "charEnd": 99 }, "text": "I asked 40 people on two market days; 31 said they travel 25 km to town for repairs and wait 3 days", "lang": "en", "textEn": "I asked 40 people on two market days; 31 said they travel 25 km to town for repairs and wait 3 days", "translit": null, "struck": false, "supersededBy": null, "confidence": null },
    { "segId": "s_0005", "source": { "type": "text", "documentId": "doc_typed_1", "charStart": 0, "charEnd": 60 }, "text": "Spare screens, batteries, charging ports, soldering supplies", "lang": "en", "textEn": "Spare screens, batteries, charging ports, soldering supplies", "translit": null, "struck": false, "supersededBy": null, "confidence": null },
    { "segId": "s_0006", "source": { "type": "text", "documentId": "doc_typed_1", "charStart": 0, "charEnd": 47 }, "text": "Two wholesale spare-part dealers in Nashik city", "lang": "en", "textEn": "Two wholesale spare-part dealers in Nashik city", "translit": null, "struck": false, "supersededBy": null, "confidence": null },
    { "segId": "s_0007", "source": { "type": "text", "documentId": "doc_typed_1", "charStart": 0, "charEnd": 106 }, "text": "₹20,000 own savings and a ₹45,000 loan; I have repaired phones for 3 years and have a training certificate", "lang": "en", "textEn": "₹20,000 own savings and a ₹45,000 loan; I have repaired phones for 3 years and have a training certificate", "translit": null, "struck": false, "supersededBy": null, "confidence": null },
    { "segId": "s_0008", "source": { "type": "text", "documentId": "doc_typed_1", "charStart": 0, "charEnd": 71 }, "text": "One shop in town; nobody in the villages; they charge ₹400 for a screen", "lang": "en", "textEn": "One shop in town; nobody in the villages; they charge ₹400 for a screen", "translit": null, "struck": false, "supersededBy": null, "confidence": null },
    { "segId": "s_0009", "source": { "type": "text", "documentId": "doc_typed_1", "charStart": 0, "charEnd": 40 }, "text": "₹350 for a screen fitting, plus the part", "lang": "en", "textEn": "₹350 for a screen fitting, plus the part", "translit": null, "struck": false, "supersededBy": null, "confidence": null },
    { "segId": "s_0010", "source": { "type": "text", "documentId": "doc_typed_1", "charStart": 0, "charEnd": 15 }, "text": "₹18,000 a month", "lang": "en", "textEn": "₹18,000 a month", "translit": null, "struck": false, "supersededBy": null, "confidence": null }
  ],
  "qa": [
    { "qId": "q1", "question": "Where do you intend to set up your business?", "questionLang": "en", "answerSegIds": ["s_0001"], "canonicalField": "location", "mappingConfidence": 0.98, "state": "answered", "overwrites": [] },
    { "qId": "q2", "question": "What products or services will you provide?", "questionLang": "en", "answerSegIds": ["s_0002"], "canonicalField": "offering", "mappingConfidence": 0.98, "state": "answered", "overwrites": [] },
    { "qId": "q3", "question": "Who are your target customers?", "questionLang": "en", "answerSegIds": ["s_0003"], "canonicalField": "customers", "mappingConfidence": 0.97, "state": "answered", "overwrites": [] },
    { "qId": "q4", "question": "Have you done any market research in your target market?", "questionLang": "en", "answerSegIds": ["s_0004"], "canonicalField": "market_research", "mappingConfidence": 0.97, "state": "answered", "overwrites": [] },
    { "qId": "q5", "question": "What raw materials will you need?", "questionLang": "en", "answerSegIds": ["s_0005"], "canonicalField": "raw_materials", "mappingConfidence": 0.98, "state": "answered", "overwrites": [] },
    { "qId": "q6", "question": "Who will be your suppliers?", "questionLang": "en", "answerSegIds": ["s_0006"], "canonicalField": "suppliers", "mappingConfidence": 0.98, "state": "answered", "overwrites": [] },
    { "qId": "q7", "question": "Which avenues will you use to raise funds, and why would they lend to you?", "questionLang": "en", "answerSegIds": ["s_0007"], "canonicalField": "funding", "mappingConfidence": 0.96, "state": "answered", "overwrites": [] },
    { "qId": "q8", "question": "Is there any competition for your business?", "questionLang": "en", "answerSegIds": ["s_0008"], "canonicalField": "competition", "mappingConfidence": 0.98, "state": "answered", "overwrites": [] },
    { "qId": "q9", "question": "What is the price per unit of your main product or service?", "questionLang": "en", "answerSegIds": ["s_0009"], "canonicalField": "unit_price", "mappingConfidence": 0.97, "state": "answered", "overwrites": [] },
    { "qId": "q10", "question": "How much do you expect to earn every month?", "questionLang": "en", "answerSegIds": ["s_0010"], "canonicalField": "monthly_revenue", "mappingConfidence": 0.97, "state": "answered", "overwrites": [] }
  ],
  "fields": {
    "location": { "value": "Near the weekly market in Sinnar, Nashik district, Maharashtra, PIN 422103", "segIds": ["s_0001"], "confidence": 0.95 },
    "offering": { "value": "Mobile phone repair (screens, batteries, charging ports) and second-hand phones", "segIds": ["s_0002"], "confidence": 0.95 },
    "customers": { "value": "Farmers and students aged 18 to 45 from 12 nearby villages", "segIds": ["s_0003"], "confidence": 0.93 },
    "market_research": { "value": "Asked 40 people on two market days; 31 travel 25 km to town and wait 3 days for repairs", "segIds": ["s_0004"], "confidence": 0.94 },
    "raw_materials": { "value": "Spare screens, batteries, charging ports, soldering supplies", "segIds": ["s_0005"], "confidence": 0.95 },
    "suppliers": { "value": "Two wholesale spare-part dealers in Nashik city", "segIds": ["s_0006"], "confidence": 0.95 },
    "funding": { "value": "₹20,000 own savings and a ₹45,000 loan; 3 years of repair experience and a training certificate", "segIds": ["s_0007"], "confidence": 0.9 },
    "self_investment": { "value": "₹20,000", "segIds": ["s_0007"], "confidence": 0.92 },
    "expected_loan": { "value": "₹45,000", "segIds": ["s_0007"], "confidence": 0.92 },
    "competition": { "value": "One repair shop in town, none in the villages; charges ₹400 per screen", "segIds": ["s_0008"], "confidence": 0.94 },
    "unit_price": { "value": "₹350 per screen fitting plus the part", "segIds": ["s_0009"], "confidence": 0.94 },
    "monthly_revenue": { "value": "₹18,000 per month", "segIds": ["s_0010"], "confidence": 0.95 }
  },
  "summary": { "value": "Village mobile phone repair stall near a weekly market, competing on distance and price with one town shop.", "segIds": ["s_0002", "s_0004", "s_0008"], "confidence": 0.9 },
  "problemAddressed": { "value": "Villagers travel 25 km and wait 3 days for phone repairs.", "segIds": ["s_0004"], "confidence": 0.9 }
}
